[
  {
    "id": "2ea363d9-f73",
    "code": "000636.SZ",
    "name": "风华高科",
    "sector": "电子元件",
    "note": "",
    "type": "full",
    "status": "failed",
    "created_at": "2026-07-21T08:47:32.743620+00:00",
    "claimed_at": null,
    "completed_at": "2026-07-21T08:54:30.828355+00:00",
    "result": null,
    "error": "已存在分析报告，跳过"
  },
  {
    "id": "37e6f99a-59d",
    "code": "002138.SZ",
    "name": "顺络电子",
    "sector": "电子元件",
    "note": "",
    "type": "full",
    "status": "completed",
    "created_at": "2026-07-21T08:47:32.746564+00:00",
    "claimed_at": "2026-07-21T09:48:21.675688+00:00",
    "completed_at": "2026-07-21T09:51:21.130099+00:00",
    "result": {
      "report_path": null,
      "summary": null,
      "reports": null
    },
    "error": null
  },
  {
    "id": "bc894320-c09",
    "code": "002282.SZ",
    "name": "博深股份",
    "sector": "通用设备",
    "note": "",
    "type": "full",
    "status": "completed",
    "created_at": "2026-07-21T08:47:32.748821+00:00",
    "claimed_at": "2026-07-21T09:51:21.149472+00:00",
    "completed_at": "2026-07-21T09:53:57.199044+00:00",
    "result": {
      "report_path": null,
      "summary": null,
      "reports": null
    },
    "error": null
  },
  {
    "id": "5f8d3f85-38b",
    "code": "002430.SZ",
    "name": "杭氧股份",
    "sector": "机械设备",
    "note": "",
    "type": "full",
    "status": "completed",
    "created_at": "2026-07-21T08:47:32.750926+00:00",
    "claimed_at": "2026-07-21T09:51:21.185268+00:00",
    "completed_at": "2026-07-21T09:53:57.229173+00:00",
    "result": {
      "report_path": null,
      "summary": null,
      "reports": null
    },
    "error": null
  },
  {
    "id": "2dfe6e28-f4d",
    "code": "002661.SZ",
    "name": "克明食品",
    "sector": "食品制造",
    "note": "",
    "type": "full",
    "status": "completed",
    "created_at": "2026-07-21T08:47:32.752982+00:00",
    "claimed_at": "2026-07-21T09:51:21.197185+00:00",
    "completed_at": "2026-07-21T09:53:57.231241+00:00",
    "result": {
      "report_path": null,
      "summary": null,
      "reports": null
    },
    "error": null
  },
  {
    "id": "a6a42e99-7ed",
    "code": "159883.SZ",
    "name": "医疗器械ETF",
    "sector": "ETF",
    "note": "",
    "type": "full",
    "status": "completed",
    "created_at": "2026-07-21T08:47:32.755111+00:00",
    "claimed_at": "2026-07-21T09:53:57.272140+00:00",
    "completed_at": "2026-07-21T09:59:00.411243+00:00",
    "result": {
      "report_path": null,
      "summary": null,
      "reports": null
    },
    "error": null
  },
  {
    "id": "91f8d6f1-da8",
    "code": "300319.SZ",
    "name": "麦捷科技",
    "sector": "电子元件",
    "note": "",
    "type": "full",
    "status": "completed",
    "created_at": "2026-07-21T08:47:32.757207+00:00",
    "claimed_at": "2026-07-21T09:53:57.292151+00:00",
    "completed_at": "2026-07-21T09:59:00.445207+00:00",
    "result": {
      "report_path": null,
      "summary": null,
      "reports": null
    },
    "error": null
  },
  {
    "id": "e953887b-b31",
    "code": "300346.SZ",
    "name": "南大光电",
    "sector": "电子化学品",
    "note": "",
    "type": "full",
    "status": "completed",
    "created_at": "2026-07-21T08:47:32.759427+00:00",
    "claimed_at": "2026-07-21T09:53:57.310531+00:00",
    "completed_at": "2026-07-21T09:59:00.467628+00:00",
    "result": {
      "report_path": null,
      "summary": null,
      "reports": null
    },
    "error": null
  },
  {
    "id": "ad355de6-bfb",
    "code": "300408.SZ",
    "name": "三环集团",
    "sector": "电子元件",
    "note": "",
    "type": "full",
    "status": "failed",
    "created_at": "2026-07-21T08:47:32.761615+00:00",
    "claimed_at": null,
    "completed_at": "2026-07-21T08:54:30.834028+00:00",
    "result": null,
    "error": "已存在分析报告，跳过"
  },
  {
    "id": "cab4dc25-a2c",
    "code": "300433.SZ",
    "name": "蓝思科技",
    "sector": "消费电子",
    "note": "",
    "type": "full",
    "status": "completed",
    "created_at": "2026-07-21T08:47:32.763731+00:00",
    "claimed_at": "2026-07-21T09:55:44.139439+00:00",
    "completed_at": "2026-07-21T09:58:09.978566+00:00",
    "result": {
      "report_path": null,
      "summary": null,
      "reports": null
    },
    "error": null
  },
  {
    "id": "674f02de-827",
    "code": "300628.SZ",
    "name": "亿联网络",
    "sector": "通信设备",
    "note": "",
    "type": "full",
    "status": "failed",
    "created_at": "2026-07-21T08:47:32.765869+00:00",
    "claimed_at": null,
    "completed_at": "2026-07-21T08:54:30.831501+00:00",
    "result": null,
    "error": "已存在分析报告，跳过"
  },
  {
    "id": "96a6540d-7e3",
    "code": "300832.SZ",
    "name": "新产业",
    "sector": "医疗器械",
    "note": "",
    "type": "full",
    "status": "failed",
    "created_at": "2026-07-21T08:47:32.768096+00:00",
    "claimed_at": null,
    "completed_at": "2026-07-21T08:54:30.840624+00:00",
    "result": null,
    "error": "已存在分析报告，跳过"
  },
  {
    "id": "229bcf50-893",
    "code": "600109.SH",
    "name": "国金证券",
    "sector": "证券",
    "note": "",
    "type": "full",
    "status": "completed",
    "created_at": "2026-07-21T08:47:32.770307+00:00",
    "claimed_at": "2026-07-21T09:58:20.423689+00:00",
    "completed_at": "2026-07-21T10:06:48.388497+00:00",
    "result": {
      "report_path": null,
      "summary": null,
      "reports": null
    },
    "error": null
  },
  {
    "id": "00dc1183-af7",
    "code": "601006.SH",
    "name": "大秦铁路",
    "sector": "交通运输",
    "note": "",
    "type": "full",
    "status": "completed",
    "created_at": "2026-07-21T08:47:32.772678+00:00",
    "claimed_at": "2026-07-21T09:59:23.163869+00:00",
    "completed_at": "2026-07-21T10:10:30.067442+00:00",
    "result": {
      "report_path": null,
      "summary": null,
      "reports": null
    },
    "error": null
  },
  {
    "id": "0d5949fc-171",
    "code": "605117.SH",
    "name": "德业股份",
    "sector": "电力设备",
    "note": "",
    "type": "full",
    "status": "completed",
    "created_at": "2026-07-21T08:47:32.774836+00:00",
    "claimed_at": "2026-07-21T09:59:23.184264+00:00",
    "completed_at": "2026-07-21T10:10:30.087628+00:00",
    "result": {
      "report_path": null,
      "summary": null,
      "reports": null
    },
    "error": null
  },
  {
    "id": "d5f6e892-df5",
    "code": "688126.SH",
    "name": "沪硅产业",
    "sector": "半导体材料",
    "note": "",
    "type": "full",
    "status": "completed",
    "created_at": "2026-07-21T08:47:32.777035+00:00",
    "claimed_at": "2026-07-21T09:59:42.273520+00:00",
    "completed_at": "2026-07-21T10:10:30.099078+00:00",
    "result": {
      "report_path": null,
      "summary": null,
      "reports": null
    },
    "error": null
  },
  {
    "id": "36d1e325-118",
    "code": "688278.SH",
    "name": "特宝生物",
    "sector": "生物制品",
    "note": "",
    "type": "full",
    "status": "completed",
    "created_at": "2026-07-21T08:47:32.780207+00:00",
    "claimed_at": "2026-07-21T09:59:23.218750+00:00",
    "completed_at": "2026-07-21T10:10:30.126570+00:00",
    "result": {
      "report_path": null,
      "summary": null,
      "reports": null
    },
    "error": null
  },
  {
    "id": "bacb7c33-19a",
    "code": "688721.SH",
    "name": "龙图光罩",
    "sector": "半导体材料",
    "note": "",
    "type": "full",
    "status": "failed",
    "created_at": "2026-07-21T08:47:32.782462+00:00",
    "claimed_at": null,
    "completed_at": "2026-07-21T08:54:30.836872+00:00",
    "result": null,
    "error": "已存在分析报告，跳过"
  },
  {
    "id": "71a26265-67c",
    "code": "688721.SH",
    "name": "龙图光罩",
    "sector": "半导体",
    "note": "",
    "type": "fundamental",
    "status": "in_progress",
    "created_at": "2026-07-23T03:14:12.583821+00:00",
    "claimed_at": "2026-08-14T03:02:41.623563+00:00",
    "completed_at": null,
    "result": null,
    "error": null
  },
  {
    "id": "6d14a4c2-fb9",
    "code": "688721.SH",
    "name": "龙图光罩",
    "sector": "半导体",
    "note": "",
    "type": "technical",
    "status": "in_progress",
    "created_at": "2026-07-23T03:14:14.445707+00:00",
    "claimed_at": "2026-08-14T03:02:41.632406+00:00",
    "completed_at": null,
    "result": null,
    "error": null
  },
  {
    "id": "b0782ab2-2c2",
    "code": "688018.SH",
    "name": "乐鑫科技",
    "sector": "半导体/物联网芯片",
    "note": "AIoT芯片龙头，Wi-Fi MCU全球领先",
    "type": "full",
    "status": "completed",
    "created_at": "2026-07-23T05:12:52.132081+00:00",
    "claimed_at": null,
    "completed_at": "2026-07-23T05:16:16.959957+00:00",
    "result": {
      "report_path": "data/688018.SH/reports/fundamental_20260723.md",
      "summary": "乐鑫科技基本面优秀（高成长、毛利率持续提升、财务稳健），但估值偏高（PE 48倍），股价已从5月高点回调46%。技术面处于下降后的横盘整理，布林带极度收窄，方向待确认。综合判断：观望。",
      "reports": null
    },
    "error": null
  },
  {
    "id": "11fef351-1e1",
    "code": "002283.SZ",
    "name": "天润工业",
    "sector": "汽车零部件",
    "note": "曲轴连杆龙头 + AIDC大缸径放量",
    "type": "full",
    "status": "completed",
    "created_at": "2026-08-02T09:17:33.090190+00:00",
    "claimed_at": "2026-08-02T09:17:39.722443+00:00",
    "completed_at": "2026-08-02T09:18:41.341246+00:00",
    "result": {
      "report_path": null,
      "summary": "天润工业基本面看好：2026Q1归母+47.7%，AIDC大缸径业务放量，2026E约20x PE；技术面处大跌后修复初期，短多中空，8.44/9.3/10.3为关键位",
      "reports": [
        {
          "path": "data/002283.SZ/reports/fundamental_20260802.md",
          "type": "fundamental"
        },
        {
          "path": "data/002283.SZ/reports/technical_20260802.md",
          "type": "technical"
        }
      ]
    },
    "error": null
  },
  {
    "id": "051d6077-ee6",
    "code": "300308.SZ",
    "name": "中际旭创",
    "sector": "通信设备",
    "note": "光模块全球龙头，800G/1.6T出货第一",
    "type": "fundamental",
    "status": "completed",
    "created_at": "2026-08-14T02:55:55.234251+00:00",
    "claimed_at": "2026-08-14T03:05:16.782302+00:00",
    "completed_at": "2026-08-14T03:05:16.789437+00:00",
    "result": {
      "report_path": "/root/data/FinanceDashboard/data/300308.SZ/reports/fundamental_20260814.md",